{
  "catalog_id": "nist-ssdf",
  "source_id": "nist-ssdf",
  "title": "Secure Software Development Framework (SSDF) Version 1.1 - practices and tasks",
  "edition": "NIST SP 800-218, SSDF Version 1.1 (February 2022)",
  "description": "The four SSDF practice groups (PO, PS, PW, RV), every practice and task from Table 1 with notional implementation examples and informative references, plus Appendix A Table 2 (EO 14028 Section 4e to SSDF tasks). Retired identifiers listed in Table 1 are kept with status 'retired'. Source: NIST public information; attribution retained; no endorsement.",
  "extraction": {
    "method": "pdfplumber column-cropped line extraction of Table 1 (scripts/extract/ssdf.py); rows aligned by task start position; group text from Section 2",
    "date": "2026-10-13",
    "fidelity": "verbatim-normalised-whitespace",
    "pages_reviewed": "13-28 (Section 2 and Table 1), 33 (Appendix A Table 2), 36 (Change Log)",
    "notes": "Practice, task, example and reference text is verbatim with line breaks normalised to single spaces; words hyphenated at a line break are joined keeping the hyphen (the SSDF table only breaks lines at real hyphens in compounds). Examples are split on the 'Example n:' prefixes. References are split on bold 'KEY:' prefixes; the reference keys are the document's own bibliography tags (e.g. SP80053 = NIST SP 800-53 Rev. 5). printed_page = pdf_page - 9. Retired ids (PW.3, PW.3.1, PW.3.2, PW.4.3, PW.4.5, PW.5.2) are kept for traceability with status 'retired' and moved_to. Tasks whose examples/references continue onto the next page carry pdf_pages."
  },
  "levels": {
    "assessment_status": [
      "implemented",
      "partial",
      "planned",
      "not-implemented",
      "not-applicable"
    ]
  },
  "groups": [
    {
      "id": "PO",
      "title": "Prepare the Organization",
      "parent": null,
      "text": "Organizations should ensure that their people, processes, and technology are prepared to perform secure software development at the organization level. Many organizations will find some PO practices to also be applicable to subsets of their software development, like individual development groups or projects.",
      "citation": {
        "pdf_page": 13,
        "printed_page": 4,
        "section": "2"
      },
      "table_label": "Prepare the Organization",
      "table_header_page": 14
    },
    {
      "id": "PS",
      "title": "Protect the Software",
      "parent": null,
      "text": "Organizations should protect all components of their software from tampering and unauthorized access.",
      "citation": {
        "pdf_page": 13,
        "printed_page": 4,
        "section": "2"
      },
      "table_label": "Protect Software",
      "table_header_page": 18
    },
    {
      "id": "PW",
      "title": "Produce Well-Secured Software",
      "parent": null,
      "text": "Organizations should produce well-secured software with minimal security vulnerabilities in its releases.",
      "citation": {
        "pdf_page": 13,
        "printed_page": 4,
        "section": "2"
      },
      "table_label": "Produce Well-Secured Software",
      "table_header_page": 20
    },
    {
      "id": "RV",
      "title": "Respond to Vulnerabilities",
      "parent": null,
      "text": "Organizations should identify residual vulnerabilities in their software releases and respond appropriately to address those vulnerabilities and prevent similar ones from occurring in the future.",
      "citation": {
        "pdf_page": 13,
        "printed_page": 4,
        "section": "2"
      },
      "table_label": "Respond to Vulnerabilities",
      "table_header_page": 25
    }
  ],
  "items": [
    {
      "id": "PO.1",
      "kind": "practice",
      "title": "Define Security Requirements for Software Development",
      "text": "Ensure that security requirements for software development are known at all times so that they can be taken into account throughout the SDLC and duplication of effort can be minimized because the requirements information can be collected once and shared. This includes requirements from internal sources (e.g., the organization’s policies, business objectives, and risk management strategy) and external sources (e.g., applicable laws and regulations).",
      "group": "PO",
      "status": "active",
      "citation": {
        "pdf_page": 14,
        "printed_page": 5,
        "section": "Table 1"
      }
    },
    {
      "id": "PO.1.1",
      "kind": "task",
      "title": "PO.1.1",
      "text": "Identify and document all security requirements for the organization’s software development infrastructures and processes, and maintain the requirements over time.",
      "group": "PO",
      "practice": "PO.1",
      "status": "active",
      "examples": [
        "Define policies for securing software development infrastructures and their components, including development endpoints, throughout the SDLC and maintaining that security.",
        "Define policies for securing software development processes throughout the SDLC and maintaining that security, including for open-source and other third-party software components utilized by software being developed.",
        "Review and update security requirements at least annually, or sooner if there are new requirements from internal or external sources, or a major security incident targeting software development infrastructure has occurred.",
        "Educate affected individuals on impending changes to requirements."
      ],
      "references": [
        {
          "ref": "BSAFSS",
          "text": "SM.3, DE.1, IA.1, IA.2"
        },
        {
          "ref": "BSIMM",
          "text": "CP1.1, CP1.3, SR1.1, SR2.2, SE1.2, SE2.6"
        },
        {
          "ref": "EO14028",
          "text": "4e(ix)"
        },
        {
          "ref": "IEC62443",
          "text": "SM-7, SM-9"
        },
        {
          "ref": "NISTCSF",
          "text": "ID.GV-3"
        },
        {
          "ref": "OWASPASVS",
          "text": "1.1.1"
        },
        {
          "ref": "OWASPMASVS",
          "text": "1.10"
        },
        {
          "ref": "OWASPSAMM",
          "text": "PC1-A, PC1-B, PC2-A"
        },
        {
          "ref": "PCISSLC",
          "text": "2.1, 2.2"
        },
        {
          "ref": "SCFPSSD",
          "text": "Planning the Implementation and Deployment of Secure Development Practices"
        },
        {
          "ref": "SP80053",
          "text": "SA-1, SA-8, SA-15, SR-3"
        },
        {
          "ref": "SP800160",
          "text": "3.1.2, 3.2.1, 3.2.2, 3.3.1, 3.4.2, 3.4.3"
        },
        {
          "ref": "SP800161",
          "text": "SA-1, SA-8, SA-15, SR-3"
        },
        {
          "ref": "SP800181",
          "text": "T0414; K0003, K0039, K0044, K0157, K0168, K0177, K0211, K0260, K0261, K0262, K0524; S0010, S0357, S0368; A0033, A0123, A0151"
        }
      ],
      "citation": {
        "pdf_page": 14,
        "printed_page": 5,
        "section": "Table 1"
      }
    },
    {
      "id": "PO.1.2",
      "kind": "task",
      "title": "PO.1.2",
      "text": "Identify and document all security requirements for organization-developed software to meet, and maintain the requirements over time.",
      "group": "PO",
      "practice": "PO.1",
      "status": "active",
      "examples": [
        "Define policies that specify risk-based software architecture and design requirements, such as making code modular to facilitate code reuse and updates; isolating security components from other components during execution; avoiding undocumented commands and settings; and providing features that will aid software acquirers with the secure deployment, operation, and maintenance of the software.",
        "Define policies that specify the security requirements for the organization’s software, and verify compliance at key points in the SDLC (e.g., classes of software flaws verified by gates, responses to vulnerabilities discovered in released software).",
        "Analyze the risk of applicable technology stacks (e.g., languages, environments, deployment models), and recommend or require the use of stacks that will reduce risk compared to others.",
        "Define policies that specify what needs to be archived for each software release (e.g., code, package files, third-party libraries, documentation, data inventory) and how long it needs to be retained based on the SDLC model, software end-of-life, and other factors.",
        "Ensure that policies cover the entire software life cycle, including notifying users of the impending end of software support and the date of software end-of-life.",
        "Review all security requirements at least annually, or sooner if there are new requirements from internal or external sources, a major vulnerability is discovered in released software, or a major security incident targeting organization-developed software has occurred.",
        "Establish and follow processes for handling requirement exception requests, including periodic reviews of all approved exceptions."
      ],
      "references": [
        {
          "ref": "BSAFSS",
          "text": "SC.1-1, SC.2, PD.1-1, PD.1-2, PD.1-3, PD.2-2, SI, PA, CS, AA, LO, EE"
        },
        {
          "ref": "BSIMM",
          "text": "SM1.1, SM1.4, SM2.2, CP1.1, CP1.2, CP1.3, CP2.1, CP2.3, AM1.2, SFD1.1, SFD2.1, SFD3.2, SR1.1, SR1.3, SR2.2, SR3.3, SR3.4"
        },
        {
          "ref": "EO14028",
          "text": "4e(ix)"
        },
        {
          "ref": "IEC62443",
          "text": "SR-3, SR-4, SR-5, SD-4"
        },
        {
          "ref": "ISO27034",
          "text": "7.3.2"
        },
        {
          "ref": "MSSDL",
          "text": "2, 5"
        },
        {
          "ref": "NISTCSF",
          "text": "ID.GV-3"
        },
        {
          "ref": "OWASPMASVS",
          "text": "1.12"
        },
        {
          "ref": "OWASPSAMM",